{
  "id": "gitbox-dark",
  "name": "GitBox Dark",
  "type": "dark",
  "meta": {
    "version": "1.0.1",
    "author": "GitBox",
    "description": "Default dark theme."
  },
  "colors": {
    "bg": "#1E1E1E",
    "bgElevated": "#252526",
    "bgOverlay": "#2D2D2D",
    "surfaceHover": "#2A2A2B",
    "border": "#2D2D2D",
    "borderStrong": "#3A3A3A",
    "textStrong": "#F2F2F2",
    "text": "#CCCCCC",
    "textMuted": "#8A8A8A",
    "accent": "#2563EB",
    "accentHover": "#3B82F6",
    "accentFg": "#FFFFFF",
    "added": "#22C55E",
    "removed": "#EF4444",
    "modified": "#57B0FF",
    "graph1": "#1E88E5",
    "graph2": "#FFAB00",
    "graph3": "#00E676",
    "graph4": "#D500F9",
    "graph5": "#FF3D00",
    "graph6": "#00B0FF",
    "graph7": "#1DE9B6",
    "graph8": "#F50057",
    "graphMarker": "#1E1E1E"
  },
  "typography": {
    "uiFont": "'IBM Plex Sans', 'Segoe UI', system-ui, sans-serif",
    "uiFontSize": 13,
    "monoFont": "'IBM Plex Mono', 'SF Mono', Consolas, monospace",
    "editorFont": "'IBM Plex Mono', 'SF Mono', Consolas, 'Courier New', monospace",
    "editorFontSize": 13,
    "editorLineHeight": 0,
    "radius": 6
  }
}
