{
  "id": "gitbox-light",
  "name": "GitBox Light",
  "type": "light",
  "meta": {
    "version": "1.0.1",
    "author": "GitBox",
    "description": "Default light theme."
  },
  "colors": {
    "bg": "#FFFFFF",
    "bgElevated": "#F6F8FA",
    "bgOverlay": "#FFFFFF",
    "surfaceHover": "#EEF1F4",
    "border": "#D0D7DE",
    "borderStrong": "#AFB8C1",
    "textStrong": "#1F2328",
    "text": "#24292F",
    "textMuted": "#656D76",
    "accent": "#0969DA",
    "accentHover": "#2178E0",
    "accentFg": "#FFFFFF",
    "added": "#1A7F37",
    "removed": "#CF222E",
    "modified": "#0969DA",
    "graph1": "#0969DA",
    "graph2": "#BF8700",
    "graph3": "#1A7F37",
    "graph4": "#8250DF",
    "graph5": "#CF222E",
    "graph6": "#0598BC",
    "graph7": "#117F6E",
    "graph8": "#BF3989",
    "graphMarker": "#FFFFFF"
  },
  "typography": {
    "uiFont": "'IBM Plex Sans', 'Segoe UI', system-ui, sans-serif",
    "uiFontSize": 13,
    "monoFont": "'IBM Plex Mono', 'SF Mono', Consolas, monospace",
    "editorFont": "'IBM Plex Mono', 'SF Mono', Consolas, 'Courier New', monospace",
    "editorFontSize": 13,
    "editorLineHeight": 0,
    "radius": 6
  }
}
