{
  "id": "gruvbox-dark",
  "name": "Gruvbox Dark",
  "type": "dark",
  "meta": {
    "version": "1.0.0",
    "author": "GitBox",
    "description": "Retro groove color scheme with warm earthy tones."
  },
  "colors": {
    "bg": "#282828",
    "bgElevated": "#3C3836",
    "bgOverlay": "#32302F",
    "surfaceHover": "#504945",
    "border": "#504945",
    "borderStrong": "#665C54",
    "textStrong": "#EBDBB2",
    "text": "#D5C4A1",
    "textMuted": "#A89984",
    "accent": "#83A598",
    "accentHover": "#458588",
    "accentFg": "#282828",
    "added": "#B8BB26",
    "removed": "#FB4934",
    "modified": "#83A598",
    "graph1": "#83A598",
    "graph2": "#8EC07C",
    "graph3": "#B8BB26",
    "graph4": "#FABD2F",
    "graph5": "#FE8019",
    "graph6": "#FB4934",
    "graph7": "#D3869B",
    "graph8": "#D79921",
    "graphMarker": "#282828"
  },
  "typography": {
    "uiFont": "'IBM Plex Sans', 'Segoe UI', system-ui, sans-serif",
    "uiFontSize": 13,
    "monoFont": "'IBM Plex Mono', 'SF Mono', Consolas, monospace",
    "editorFont": "'IBM Plex Mono', 'SF Mono', Consolas, 'Courier New', monospace",
    "editorFontSize": 13,
    "editorLineHeight": 0,
    "radius": 6
  }
}
