{
  "id": "one-dark-pro",
  "name": "One Dark Pro",
  "type": "dark",
  "meta": {
    "version": "1.0.1",
    "author": "GitBox",
    "description": "Atom's iconic One Dark, refined."
  },
  "colors": {
    "bg": "#282C34",
    "bgElevated": "#21252B",
    "bgOverlay": "#2C313A",
    "surfaceHover": "#333842",
    "border": "#181A1F",
    "borderStrong": "#3B4048",
    "textStrong": "#FFFFFF",
    "text": "#ABB2BF",
    "textMuted": "#5C6370",
    "accent": "#61AFEF",
    "accentHover": "#7CC0F5",
    "accentFg": "#282C34",
    "added": "#98C379",
    "removed": "#E06C75",
    "modified": "#61AFEF",
    "graph1": "#61AFEF",
    "graph2": "#98C379",
    "graph3": "#E06C75",
    "graph4": "#C678DD",
    "graph5": "#E5C07B",
    "graph6": "#56B6C2",
    "graph7": "#D19A66",
    "graph8": "#BE5046",
    "graphMarker": "#282C34"
  },
  "typography": {
    "uiFont": "'IBM Plex Sans', 'Segoe UI', system-ui, sans-serif",
    "uiFontSize": 13,
    "monoFont": "'IBM Plex Mono', 'SF Mono', Consolas, monospace",
    "editorFont": "'IBM Plex Mono', 'SF Mono', Consolas, 'Courier New', monospace",
    "editorFontSize": 13,
    "editorLineHeight": 0,
    "radius": 6
  }
}
